{
  "exam": "A",
  "source": "ISTQB CTFL v4.0 Sample Exam A v1.7",
  "totalQuestions": 40,
  "totalPoints": 40,
  "passingScore": 26,
  "questions": [
    {
      "id": "1",
      "number": 1,
      "section": "main",
      "points": 1,
      "learningObjective": "FL-1.1.1",
      "kLevel": "K1",
      "selectCount": 1,
      "question": "Which of the following statements describe a valid test objective?",
      "options": [
        {
          "letter": "a",
          "text": "To prove that there are no unfixed defects in the system under test",
          "isCorrect": false,
          "explanation": "Is not correct. It is impossible to prove that there are no defects anymore in the system under test. See testing principle 1"
        },
        {
          "letter": "b",
          "text": "To prove that there will be no failures after the implementation of the system into production",
          "isCorrect": false,
          "explanation": "Is not correct. See testing principle 7"
        },
        {
          "letter": "c",
          "text": "To reduce the risk level of the test object and to build confidence in the quality level",
          "isCorrect": true,
          "explanation": "Is correct. Testing finds defects and failures which reduces the level of risk and at the same time gives more confidence in the quality level of the test object"
        },
        {
          "letter": "d",
          "text": "To verify that there are no untested combinations of inputs",
          "isCorrect": false,
          "explanation": "Is not correct. It is impossible to test all combinations of inputs (see testing principle 2)"
        }
      ]
    },
    {
      "id": "2",
      "number": 2,
      "section": "main",
      "points": 1,
      "learningObjective": "FL-1.2.1",
      "kLevel": "K2",
      "selectCount": 1,
      "question": "Which of the following options shows an example of test activities that contribute to success?",
      "options": [
        {
          "letter": "a",
          "text": "Having testers involved during various software development lifecycle (SDLC) activities will help to detect defects in work products",
          "isCorrect": true,
          "explanation": "Is correct. It is important that testers are involved from the beginning of the software development lifecycle (SDLC). It will increase understanding of design decisions and will detect defects early."
        },
        {
          "letter": "b",
          "text": "Testers try not to disturb the developers while coding, so that the developers write better code",
          "isCorrect": false,
          "explanation": "Is not correct. Both developers and testers will have more understanding of each other's work products and how to test the code"
        },
        {
          "letter": "c",
          "text": "Testers collaborating with end users help to improve the quality of defect reports during component integration and system testing",
          "isCorrect": false,
          "explanation": "Is not correct. End users will not help the testers in increasing the quality of defect reports; also, users usually do not participate in low-level testing levels like integration testing"
        },
        {
          "letter": "d",
          "text": "Certified testers will design much better test cases than non-certified testers",
          "isCorrect": false,
          "explanation": "Is not correct. Being certified does not automatically mean that the tester will be better in test design"
        }
      ]
    },
    {
      "id": "3",
      "number": 3,
      "section": "main",
      "points": 1,
      "learningObjective": "FL-1.3.1",
      "kLevel": "K2",
      "selectCount": 1,
      "question": "You have been assigned as a tester to a team producing a new system incrementally. You have noticed that no changes have been made to the existing regression test cases for several iterations and no new regression defects were identified. Your manager is happy, but you are not. Which testing principle explains your skepticism?",
      "options": [
        {
          "letter": "a",
          "text": "Tests wear out",
          "isCorrect": true,
          "explanation": "Is correct. This principle means that if the same tests are repeated over and over again, eventually these tests no longer find any new defects. This is probably why the tests all passed in this release as well"
        },
        {
          "letter": "b",
          "text": "Absence-of-defects fallacy",
          "isCorrect": false,
          "explanation": "Is not correct. This principle says about the mistaken belief that just finding and fixing a large number of defects will ensure the success of a system"
        },
        {
          "letter": "c",
          "text": "Defects cluster together",
          "isCorrect": false,
          "explanation": "Is not correct. This principle says that a small number of components usually contain most of the defects"
        },
        {
          "letter": "d",
          "text": "Exhaustive testing is impossible",
          "isCorrect": false,
          "explanation": "Is not correct. This principle states that testing all combinations of inputs and preconditions is not feasible"
        }
      ]
    },
    {
      "id": "4",
      "number": 4,
      "section": "main",
      "points": 1,
      "learningObjective": "FL-1.4.1",
      "kLevel": "K2",
      "selectCount": 1,
      "question": "You work in a team that develops a mobile application for food ordering. In the current iteration the team decided to implement the payment functionality.\nWhich of the following activities is a part of test analysis?",
      "options": [
        {
          "letter": "a",
          "text": "Estimating that testing the integration with the payment service will take 8 person-days",
          "isCorrect": false,
          "explanation": "Is not correct. Estimating the test effort is part of test planning"
        },
        {
          "letter": "b",
          "text": "Deciding that the team should test if it is possible to properly share payment between many users",
          "isCorrect": true,
          "explanation": "Is correct. This is an example of defining test conditions which is a part of test analysis"
        },
        {
          "letter": "c",
          "text": "Using boundary value analysis (BVA) to derive the test data for the test cases that check the correct payment processing for the minimum allowed amount to be paid",
          "isCorrect": false,
          "explanation": "Is not correct. Using test techniques to derive coverage items is a part of test design"
        },
        {
          "letter": "d",
          "text": "Analyzing the discrepancy between the actual result and expected result after executing a test case that checks the process of payment with a credit card, and reporting a defect",
          "isCorrect": false,
          "explanation": "Is not correct. Reporting defects found during dynamic testing is a part of test execution"
        }
      ]
    },
    {
      "id": "5",
      "number": 5,
      "section": "main",
      "points": 1,
      "learningObjective": "FL-1.4.2",
      "kLevel": "K2",
      "selectCount": 1,
      "question": "Which of the following factors have a SIGNIFICANT influence on the test approach?\ni. The SDLC\nii. The number of defects detected in previous projects\niii. The identified product risks\niv. New regulatory requirements forcing formal white-box testing\nv. The test environment setup",
      "options": [
        {
          "letter": "a",
          "text": "i, ii have significant influence",
          "isCorrect": false,
          "explanation": "Is not correct"
        },
        {
          "letter": "b",
          "text": "i, iii, iv have significant influence",
          "isCorrect": true,
          "explanation": "Is correct"
        },
        {
          "letter": "c",
          "text": "ii, iv, v have significant influence",
          "isCorrect": false,
          "explanation": "Is not correct"
        },
        {
          "letter": "d",
          "text": "iii, v have significant influence",
          "isCorrect": false,
          "explanation": "Is not correct"
        }
      ],
      "rationale": "i. Is true. The SDLC has an influence on the test approach\nii. Is false. The number of defects detected in previous projects may\nhave some influence, but this is not as significant as i, iii and iv\niii. Is true. The identified product risks are one of the most important\nfactors influencing the test approach\niv. Is true. Regulatory requirements are important factors influencing the\ntest approach\nv. Is false. The test environment has no significant influence on the test\napproach\nThus:"
    },
    {
      "id": "6",
      "number": 6,
      "section": "main",
      "points": 1,
      "learningObjective": "FL-1.4.5",
      "kLevel": "K2",
      "selectCount": 2,
      "question": "Which TWO of the following tasks belong MAINLY to a testing role?",
      "options": [
        {
          "letter": "a",
          "text": "Configure test environments",
          "isCorrect": true,
          "explanation": "Is correct. This is done by the testers"
        },
        {
          "letter": "b",
          "text": "Maintain the product backlog",
          "isCorrect": false,
          "explanation": "Is not correct. The product backlog is built and maintained by the product owner"
        },
        {
          "letter": "c",
          "text": "Design solutions to new requirements",
          "isCorrect": false,
          "explanation": "Is not correct. This is done by the development team"
        },
        {
          "letter": "d",
          "text": "Create the test plan",
          "isCorrect": false,
          "explanation": "Is not correct. This is a managerial role"
        },
        {
          "letter": "e",
          "text": "Analyze the test basis",